단어/표현,뜻,예문,날짜(YYMMDD),담당
Opt in,To choose to take part in something or to agree to be involved in a specific activity (usually by giving formal permission).,"Starting later on Friday, users who opt in can message the AI agent through Baidu’s main search app to complete tasks.",260208,병찬
Rollout,"The official launch or introduction of a new product, service, or system, often happening in stages rather than all at once.","The rollout comes just days ahead of China’s Lunar New Year holiday, as Chinese internet tech giants race to attract new users.",260208,병찬
Surged in,"To have a sudden, powerful, and rapid increase in a particular quality, amount, or state (like popularity or price).",AI agents such as OpenClaw have surged in popularity recently for their ability to automate tasks.,260208,병찬
unfettered,Not limited or restricted; completely free.,Cybersecurity firms including CrowdStrike have warned the public about granting OpenClaw unfettered access to enterprise systems.,260208,병찬
most talked-about,"Something or someone that is attracting the most attention, discussion, or controversy at a particular time.","Through several name changes, adoption across Silicon Valley to Beijing, and mounting controversy, the open-source AI agent now known as “OpenClaw” has emerged as one of the most talked-about tools in the artificial intelligence space this year.",260208,규영
mounting controversy,"A disagreement or argument that is steadily increasing in intensity, scale, or seriousness.","Through several name changes, adoption across Silicon Valley to Beijing, and mounting controversy, the open-source AI agent now known as “OpenClaw” has emerged as one of the most talked-about tools in the artificial intelligence space this year.",260208,규영
ascension,1. The act of rising or moving to a higher level or position.,"Its sudden ascension(혜성같은 등장), driven by its capabilities and social media attention, comes amid growing interest in AI agents that can autonomously complete tasks, make decisions, and take actions on behalf of users without constant human guidance.",260208,규영
Mainstream consciousness,The shared awareness or understanding of a topic by the majority of people in a society.,"Until recently, AI agents have failed to reach mainstream consciousness in the same way large language models did following the emergence of OpenAI’s ChatGPT, but OpenClaw could signal a shift.",260208,규영
tech-savvy,"Well-informed about or proficient in the use of modern technology, especially computers and the internet.","To use OpenClaw, one has to install it on a server or local device and connect it to a large language model such as Anthropic’s Claude model or ChatGPT— a process that might be difficult for less tech-savvy users.",260208,규영
lethal trifecta,"A combination of three things that causes extreme damage, failure, or death. It describes a situation where three negative factors converge to create a ""perfect storm.""","Security experts, however, have raised alarms. Cybersecurity firm Palo Alto Networks, for example, warned that the AI agent presents a “lethal trifecta” of risks stemming from its access to private data, exposure to untrusted content and ability to perform external communications while retaining memory.",260208,규영
upvote (downvote),"An act of registering approval of or support for a post or comment on a social media site or forum, typically by clicking a specific icon (usually an upward-pointing arrow).","The platform functions like an online forum, similar to Reddit, where users’ OpenClaw agents post written content and interact with other chatbots through comments and upvotes or downvotes.",260208,규영
Plunge,to fall or drop suddenly and sharply.,"Gold and silver prices plunged Friday, as President Donald Trump’s nomination for the next chair of the Federal Reserve, Kevin Warsh, appeared to relieve concerns about the central bank’s independence and sent the dollar soaring.",260201,병찬
Silver futures,contracts to buy or sell silver at a fixed price on a specific future date.,"Silver futures plummeted 31.4% to settle at 78.53, marking its worst day since March 1980.",260201,병찬
gained steam,"to grow stronger, faster, or more popular over time.","However, they gained steam in afternoon U.S. trading as investors who piled into the metals raced to book profits.",260201,병찬
Piled into,"to move into it in large numbers, quickly and enthusiastically.","However, they gained steam in afternoon U.S. trading as investors who piled into the metals raced to book profits",260201,병찬
greenback,the US dollar (USD).,metals would replace the greenback as the globe’s reserve currency.,260201,병찬
Front-runner,"the person, company, or option that is currently leading and most likely to win or succeed.",but Warsh became the front-runner in prediction markets in recent days.,260201,병찬
honorable discharge,A release from military service with a favorable record. It indicates that the service member performed their duties satisfactorily and met or exceeded the required standards of conduct.,"“It’s time to basically bring the Model S and X programs to an end with an honorable discharge,” Musk said.",260201,규영
slashed,"1. To greatly reduce an amount, price, or quantity.","After the original Roadster, the two models are Tesla’s oldest vehicles, and in recent years the company has slashed prices as global competition for electric vehicles has soared.",260201,규영
bipedal,Using only two legs for walking. It comes from the Latin words 'bi-' (meaning two) and 'ped-' (meaning foot).,"Tesla is developing Optimus with the aim of someday selling it as a bipedal, intelligent robot capable of everything from factory work to babysitting.",260201,규영
accounted for,1. To form a particular amount or part of something.,"Tesla’s far more popular models are the 3 and Y, which accounted for 97% of the company’s 1.59 million deliveries last year",260201,규영
Laud,to praise someone or something highly and publicly,"A landmark trade deal between the European Union and India has been lauded as a major breakthrough for Europe’s biggest carmakers, although analysts have flagged competition concerns in one of the world’s fastest growing markets.",260125,병찬
Amid,in the middle of / during / surrounded by something (usually something happening at the same time).,"The long-pending agreement, which comes as both sides seek to strengthen ties amid U.S. tensions, includes slashing tariffs on imports of EU-made cars to 10% from as high as 110% under a quota of 250,000 vehicles per year.",260125,병찬
off by,different from the correct or expected amount.,"Europe’s Stoxx Automobiles and Parts index traded nearly 1% lower on the news, however, with Volkswagen, BMW and France’s Renault all off by around 1.3% during morning deals.",260125,병찬
To be sure,"used to acknowledge a point as true before introducing a contrast, clarification, or limitation.","To be sure, India represents the world’s third-largest market for passenger cars worldwide and auto industry groups expect tax cuts, particularly for smaller vehicles, to stimulate the country’s market significantly in 2026.",260125,병찬
in favour of,"supporting, approving of, or preferring something.","With this agreement, Europe is sending a clear signal in favour of rules-based trade and against the law of the jungle,” he added.",260125,병찬
boon,"something that is very helpful, beneficial, or advantageous.",‘A boon to European automakers’,260125,병찬
crux,the most important or decisive point of an issue; the core of the problem.,"That’s the first thing and this is probably the crux of why they would do something like this at this point,” Hsiao told CNBC on Tuesday.",260125,병찬
obsolete,No longer produced or used; out of date because something newer and better has been invented.,It’s ‘a fear of becoming obsolete’,260125,규영
vex,"To annoy, frustrate, or worry someone,",Other therapists said the technology is also vexing their patients.,260125,규영
go deeply into,"To examine, investigate, or explain something in great detail; to explore the complexities of a subject.","It goes deeply into questions of personal value, which is all very unsettling",260125,규영
Underneath,"1. Directly below or beneath something else, often being covered by it.","Underneath these feelings is usually “a younger part that’s terrified of being left behind or not being ‘enough,’ and that fear gets amplified because the technology itself feels so fast and out of our control,”",260125,규영
grieve,"To feel or show great sorrow or distress, especially because of someone's death or a significant loss","Allow yourself to grieve and comfort the parts of you that feel shocked, hopeless and afraid right now",260125,규영
disruptive,1. Causing trouble and therefore stopping something from continuing as usual. (Negative),But the disruptive and uncertain moment can also be a chance for reflection,260125,규영
a sense of agency,"The subjective awareness that one is initiating, executing, and controlling one's own volitional actions in the world. It is the feeling of being in the ""driver's seat"" of your own life.","Learning enough about AI to understand where it genuinely alters work, and where it does not, often restores a sense of agency",260125,규영
Drain,Literal meaning: remove liquid,"She advises writing down what's working in your life, what's draining you or no longer fits, and where are you running on autopilot.",260118,병찬
sets someone up for a fall,“Set someone up” → put them in a particular situation,"Promising yourself ""I'll always go for a run on a Wednesday"" or ""I'm never drinking again"" just sets you up for a fall.",260118,병찬
relapse,to return to a bad condition or behavior after a period of improvement.,Plan for relapse,260118,병찬
slip up,"to make a small mistake, usually unintentionally","If you slip up, ""the most helpful response is curiosity rather than criticism"" and instead of waiting for the following week or next month to start again, you should treat every day as a reset.",260118,병찬
whereby,"""By which"" or ""through which."" It is a conjunction used to introduce a clause that explains how something is achieved or the method by which something happens.",The two companies noted they have entered into a multi-year contract whereby Apple will use Google’s Gemini model and cloud computing technology to power AI features.,260118,규영
tease,"1) To laugh at someone or say unkind things to them, either because you want to joke with them or because you want to upset them.","The move could help Apple accelerate the release of its more advanced, AI-powered version of its Siri voice assistant, which was delayed after first being teased at the company’s 2024 Worldwide Development Conference.",260118,규영
rocky years,"A period of time characterized by instability, difficulties, or uncertainty. It refers to a situation that is not going smoothly, much like a road full of large rocks that makes driving difficult.","Apple is betting on added AI capabilities, including the updated Siri, to boost device sales after several rocky years for the iPhone.",260118,규영
elephant in the room,"An obvious major problem or issue that people are avoiding discussing or acknowledging because it is uncomfortable, sensitive, or embarrassing.",This is what the Street has been waiting for with the elephant in the room for Cupertino revolving around its invisible AI strategy,260118,규영
incorporate,"To include something within a larger group, system, or plan so that it becomes a part of it.",Apple was planning to pay around 1 billion per year to incorporate Gemini into the updated version of Siri,260118,규영
off guard,To catch someone off guard = to surprise someone because they were not prepared or not expecting something.,"A company can catch its competitors off guard by launching surprise attacks, such as new product launches, aggressive marketing campaigns, or acquisitions.",260111,병찬
Relentless drive,"an intense, continuous determination to achieve a goal, without giving up or slowing down","This “spirit” can manifest in various ways, such as innovative thinking, customer-centricity, and a relentless drive for excellence.",260111,병찬
Coalitions,"groups of different people, parties, or organizations that temporarily work together toward a common goal.","These coalitions can provide access to new markets, shared resources, and a stronger competitive position.",260111,병찬
Complacent,being too satisfied with the current situation and therefore not trying to improve or prepare for risks.,A company that becomes too complacent or arrogant in its position of dominance may become vulnerable to competitors.,260111,병찬
differentiators,"Factors or characteristics that make a product, service, or company different from and better than its competitors.",NVIDIA's pivot toward AI at scale and AI systems as differentiators will help keep it way ahead of rivals,260111,규영
profound shift,"A deep, fundamental, and significant change in the way something is done, thought about, or organized.","Alpamayo represents a profound shift for NVIDIA, moving from being primarily a compute to a platform provider for physical AI ecosystems",260111,규영
long tail of the distribution,"The ""tail"" is the part of a list or graph where things happen very rarely. The ""long tail"" means there are so many of these rare things that they become a big problem (or opportunity) to handle",What they will find is that it's easy to get to 99% and then super hard to solve the long tail of the distribution.,260111,규영
overhyped,To publicize or promote something excessively; so much that the actual quality or value does not meet the high expectations.,"It became the first company to reach 5tn in October, but has lost value over concerns about whether demand AI is overhyped",260111,규영
be about to,To be on the point of doing something. to be ready to do something very soon,"it tells you what it's going to do, and it reasons about what it's about to do",260111,규영
a close ally of,"someone or a group that has a strong, trusted, and cooperative relationship with X","Isaacman, a close ally of SpaceX CEO Elon Musk, told CNBC’s “Closing Bell Overtime” that Trump’s recommitment to exploring the moon is key to unlocking the “orbital economy.”",251228,병찬
saga,"a long, complicated series of events, often involving conflict, problems, or drama.","Isaacman’s comments on Friday were some of his first public remarks since being confirmed to his position by the Senate last week, after a long saga throughout 2025.",251228,병찬
Propel,"to push or drive something forward, often quickly or powerfully.",The campaign was propelled after Trump’s One Big Beautiful Bill Act allocated 9.9 billion to NASA earlier this year.,251228,병찬
water down,To dilute: To make a liquid thinner or weaker by adding water.,EU waters down plans to end new petrol and diesel car sales by 2035,251228,규영
Lobby,"To try to persuade a politician, the government, or an official group that a particular law or situation should be changed or maintained.","Current rules state that new vehicles sold from that date should be ""zero emission"", but carmakers, particularly in Germany, have lobbied heavily for concessions.",251228,규영
concessions (kənˈseSH(ə)n),A point that you willingly yield to the other side because you want to reach a deal.,"Current rules state that new vehicles sold from that date should be ""zero emission"", but carmakers, particularly in Germany, have lobbied heavily for concessions.",251228,규영
undermine,To weaken something secretly or gradually from the base,Opponents of the move have warned that it risks undermining the transition towards electric vehicles and leaving the EU exposed in the face of foreign competition.,251228,규영
breathing space,A pause in a difficult situation that allows you to recover or think.,"Policy makers must provide breathing space to manufacturers to sustain jobs, innovation and investments",251228,규영
sound,"Financially secure: (Business) Robust, stable, and not at risk of failing.","German carmaker Volkswagen welcomed the European Commission's draft proposal on new CO₂ targets, calling it ""economically sound overall"".",251228,규영
a slew of,a large number or a lot of something,"The photo, released on Friday along with a slew of other files, shows a desk displaying a large assortment of framed and unframed photographs and other items.",251207,병찬
Lawmakers,"people who make, amend, or vote on laws.",Lawmakers on Saturday were quick to note that the image was missing from the DOJ website.,251207,병찬
redact,remove or hide sensitive or confidential information from a document before it is shared.,The DOJ said in a post on X late Friday that it wasn’t “redacting the names of any politicians” and cited comments made by Blanche reiterating such.,251207,병찬
consistent string of,"a continuous, unbroken sequence of similar events, achievements, or problems.","Apple for decades has been known for a consistent string of design-forward, tech-defining consumer products that have shaped how people use technology.",251207,규영
at a crossroads,being at a point in time when a critical decision must be made that will have far-reaching consequences.,"Now the company known for its steadiness is going through a shakeup at the top, as both Apple and the tech industry at large are at a crossroads.",251207,규영
niche product,"a good or service that serves a specific, small, and specialized market segment.","And Apple’s expensive Vision Pro headset, the first new computing category the company has introduced since the decade-old Apple Watch, is still a niche product.",251207,규영
juggernaut,"a massive, inexorable force or object that crushes everything in its path. In a figurative sense, it refers to a huge, powerful, and overwhelming organization, campaign, or movement that cannot be stopped.",The iPhone is still a juggernaut,251207,규영
rip the Band-Aid off,"to do something that is going to be painful, difficult, or unpleasant quickly, rather than delaying it and drawing out the agony.",This is against the typical culture of Apple. But they need to rip the Band-Aid off,251207,규영
cogs in a wheel,"an individual who is just one small part of a much larger system or organization, and not very important by themselves.",His 2015 Ted Talk ‘The way we think about work is broken’ implored listeners to stop thinking about employees as simply cogs in a wheel and look for a deeper meaning to try and make work more satisfying.,251202,병찬
signpost,"to clearly indicate, highlight, or point out something so people can understand what is coming next.","They climb the ladder and see it as an experience of progress and growth, signposted by promotions, pay rises and more responsibility.",251202,병찬
permeate,"to spread through something, to exist everywhere inside it, or to deeply influence it.","employees should feel that they are contributing to a powerful, overarching mission, that should permeate through their everyday tasks so they feel as though they are part of something bigger than themselves.",251202,병찬
Deadly (Inflected form: deadlier; deadliest),Adj. Causing or likely to cause death. Extremely dangerous.,Hong Kong has suffered its deadliest fire in decades,251202,규영
blaze,To burn fiercely and brightly.,"Wan watched television in his home, unaware of the danger blazing his way",251202,규영
engulf,To completely surround or cover something; to overwhelm.,"Throughout the next few hours, horrified onlookers watched as the complex – home to more than 4,000 people, many of them elderly – rapidly became engulfed in flames",251202,규영
devastation,Severe and widespread destruction or ruin; great desolation or overwhelming grief.,"By nightfall, the scale of the devastation was becoming clear.",251202,규영
fend off,to defend yourself from something / to prevent something unpleasant or unwanted,"driven by investor confidence in its ability to fend off the threat from OpenAI, the developer of ChatGPT.",251123,병찬
slippage,a delay or shortfall compared to the planned schedule or target,"While the company maintains its target of reaching net zero emissions by 2030, the CEO acknowledges there will be slippage, saying",251123,병찬
Yet,“However” / “Nevertheless” / “But still” → It connects two contrasting ideas.,"These chips form the computational backbone of AI systems, processing the vast calculations required to train and run machine learning models. Yet questions about market sustainability continue to mount.",251123,병찬
flurry,n. a brief and light snowfall,,251123,규영
a flurry of : A large number of things happening suddenly and within a short period of time.,,Saudi Arabia is strengthening its ties with American AI companies — announcing a flurry of new joint ventures worth billions of dollars.,251123,규영
de facto,"Existing or being something in fact, although not officially recognized or legally established.","The country seeks to make its mark in the AI industry as its de facto leader, Crown Prince Mohamed bin Salman, makes his first visit to the United States in years.",251123,규영
sovereign,"n. A supreme ruler, especially a king or queen.",Humain — an AI company backed by Saudi Arabia’s sovereign wealth fund — announced a series of partnerships with prominent American tech companies,251123,규영
firm up,"To make something more definite, clear, or settled.",Saudi Arabia is trying to further firm up ties with the United States and shift its economy away from oil.,251123,규영
redemption,"The act of saving or being saved from sin, error, or evil.",The investment from Saudi Arabia also plays a major part in Prince bin Salman’s redemption in the United States,251123,규영
leap,"a common metaphor meaning a big or sudden improvement, change, or move forward.","The next leap in telecom isn’t just from 5G to 6G - it’s a fundamental redesign of the network to deliver AI-powered connectivity, capable of processing intelligence from the data centre all the way to the edge.",251116,병찬
matters,means “is important” or “has significance.”,This architecture matters because it reduces latency for applications that cannot tolerate delays,251116,병찬
A significant step forward,"an important improvement, progress, or advancement toward a goal.","Renewing our 5G partnership with Nokia marks a significant step forward in delivering seamless, high-performance connectivity to our customers.",251116,병찬
on the horizon,Likely to happen soon; expected in the near future.,the artificial intelligence industry’s data centers are increasingly a target for blame with U.S. mid-term elections on the horizon.,251116,규영
Harbinger,Something that foreshadows or announces what is to come.,The governor’s race could be a harbinger of political headwinds for the AI industry’s data center buildout with the mid-term elections just a year away,251116,규영
affordability,The degree to which something is affordable;,It is an extremely large component of the affordability crisis we’re experiencing right now,251116,규영
heighten,,Fears of an artificial intelligence bubble have heightened this week after U.S. technology shares slumped.,251109,병찬
wobble,,"This week’s equity market wobble, which saw a retreat in U.S. artificial intelligence-related stocks amid ongoing concerns over stretched valuations, has thrust contagion fears into the spotlight for global investors.",251109,병찬
alert,"Being watchful, quick to notice things, or ready to act.","We have to be very alert to these risks,” Bailey said",251109,병찬
loom,"to appear as a large, unclear, or threatening shape; to seem likely to happen soon, often in a worrying way.",Why human-shaped robots loom large in Musk's Tesla plans,251109,규영
whopping,"extremely large; surprisingly big in size, amount, or degree.",One of the many tasks Musk must complete to get his whopping pay deal is to deliver a million AI bots over the next decade.,251109,규영
dexterity,the ability to use your hands or body skillfully and quickly.,"Forrester analyst Brian Hopkins said the falling costs of components, combined with improvements to robot dexterity and AI, was helping to make humanoid robots feasible for a variety of different settings.",251109,규영
major blow,"an idiomatic expression that means a serious setback, loss, or negative impact — often sudden and significant.",Iranian officials have confirmed the facilities were struck but denied it had suffered a major blow.,251106,병찬
enrichment,"the process of improving, enhancing, or adding value to something, often by making it more meaningful, interesting, or beneficial.",One of the targets was Fordo - a uranium enrichment plant hidden in a remote mountainside that is vital to Iran's nuclear ambitions,251106,병찬
Watchdog,"an organization or person that monitors and oversees others to ensure proper behavior, especially to prevent wrongdoing or abuse of power.",Both Saudi Arabia and the UN's nuclear watchdog the International Atomic Energy Agency (IAEA) say there has been no increase in radiation levels after the attack.,251106,병찬
Self-imposed,"Decided or applied by oneself, not by an external authority.","As his self-imposed July 9 deadline for deals approaches with few new agreements in place, Trump has threatened to raise tariffs again.",251106,병찬
