단어/표현,뜻,예문,날짜(YYMMDD),담당,보라색여부
poach,1. To illegally hunt or fish on someone else's land.,China poaches more AI talent from the U.S. as it eyes the next ‘super-app’,260619,규영,Y
frontier,The extreme limit of understanding or achievement in a particular area. (최첨단의),"Yao said Friday his vision for AGI will require foundational knowledge, products and frontier exploration.",260619,규영,Y
untapped,"Not yet exploited, used, or tapped into.","“I don’t think ChatGPT or Claude will be the only super-app,” Yao said, saying untapped potential is in the “trillions of dollars.”",260619,규영,Y
stave off,"To avert or delay something bad or dangerous from happening. (간신히 모면하다, 저지하다, (위기 등의 도래를) 지연시키다.)",The company called for an industry slowdown or pause in new model development to stave off disruption to society.,260619,규영,Y
drawn (draw),"To pull or drag something; to attract someone's attention or interest. (당기다, (커튼을) 치다/걷다, (주의·비판·관심을) 끌다, 매혹하다.)",Anthropic has emphasized AI safety from its founding and drawn criticism from rivals that its safety warnings are designed to hobble competition.,260619,규영,Y
hobble,"To restrict the activity or development of something; to hamper. (방해하다, 저해하다, 유효성을 떨어뜨리다.)",Anthropic has emphasized AI safety from its founding and drawn criticism from rivals that its safety warnings are designed to hobble competition.,260619,규영,Y
That explains it,어쩐지,"That explains it, I thought it was strange.",260619,병찬,Y
For some reason,왠지 모르게 (=I don't know why),"For some reason, I feel really exhausted today.",260619,병찬,Y
It figures,"어쩐지 뻔하지, 그러면 그렇지",She didn't reply to your email? It figures.,260619,병찬,Y
Back then,"그 당시에는, 예전에는",I used exercise every day back then.,260619,병찬,Y
To overdo it,"행동, 운동, 노력 등을 과하게 해서 무리하다.",Don't overdo it at the gym today.,260619,병찬,Y
To read the room,"상황 파악을 잘하다, 분위기 읽다.",You need to learn to read the room.,260619,병찬,Y
To walk on eggshells,조마조마하다. 살얼음판을 걷게 하다.,I was walking on eggshells trying to explain to her why I came home that late.,260619,병찬,Y
Relate to,공감하다,I can totally relate to that.,260619,병찬,Y
Feel for Someone,안타깝게 여기다,I really feel for you.,260619,병찬,Y
Stand,견디다. 참다,I can't stand his attitude.,260619,병찬,Y
ingrained,"(Of habits, beliefs, or attitudes) firmly fixed and difficult to change.",the biggest barrier to getting real value from AI isn’t the technology or the workers themselves — it’s the ingrained culture of the organizations where they work.,260522,규영,Y
norms,A standard or pattern of social behavior that is typical or expected of a group.,"Employees are ready to reinvent how they work, but the system around them—metrics, incentives, and norms—continues to reinforce the old way",260522,규영,Y
capitalize,1. To take the chance to gain an advantage from something,"The takeaway: For companies to truly capitalize on the AI revolution,",260522,규영,Y
overhaul,To take apart a machine or system in order to examine it and repair it if necessary; to make major changes to a system to improve it.,"leaders need to fundamentally overhaul how work is structured, managed, and rewarded, rather than simply handing workers new tools and expecting them to figure it out.",260522,규영,Y
midway,"halfway through something, between two points or stages.",You’ve midway through a difficult conversation or negotiation.,260522,병찬,Y
off-hand comment,"a remark made casually, without much thought or preparation — something said spontaneously, not planned.","The other person has just about pushed you to your limit, maybe with an off-hand comment or a string of subtle digs.",260522,병찬,Y
string of subtle digs,"String of = a series of repeated things one after another
Subtle = not obvious, hard to notice
Digs = indirect insults or criticisms — not direct attacks, but little remarks that quietly put someone down","The other person has just about pushed you to your limit, maybe with an off-hand comment or a string of subtle digs.",260522,병찬,Y
heart is racing,"your heart is beating very fast — usually because of excitement, fear, nervousness, or anticipation.",Your heart is racing.,260522,병찬,Y
zinger,"a sharp, witty, or clever remark that is surprisingly funny or cutting",Your brain calls to mind that perfect zinger.,260522,병찬,Y
Lost your footing,"suddenly lose your balance, stability, or control — either literally or figuratively.",There’s a way to catch yourself mid-sentence and pivot without looking like you’ve totally lost your footing.,260522,병찬,Y
Cognitive friction,"The mental effort or resistance experienced by a user when an interface or system does not work as expected, or is difficult to understand.","Others raise concerns that AI users could be surrendering the cognitive friction that makes thinking sharp, and that as a society we may have fewer original ideas",260510,규영,Y
Atrophy,"The gradual decline of a skill, ability, or quality due to lack of use. (물리적, 생물학적 또는 기능적 퇴화)","There's plenty of evidence that if you are not doing as much of the actual thinking, then your capability to do that kind of thinking is going to atrophy",260510,규영,Y
Inherent,"Existing in something as a permanent, essential, or characteristic attribute.","Why do we think AI is going to be that different from other things that our brain has already adapted to?"" Benge says. ""It's not inherent to the tool to be good or bad",260510,규영,Y
ephemeral AI,"Ephemeral means something that lasts only for a very short time — temporary, fleeting, quickly gone.","Unlike ephemeral AI chats, this method treats knowledge as a compounding asset, allowing the LLM to maintain indexes and relationships between files without needing complex infrastructure.",260510,병찬,Y
takeaway,"means the main point, lesson, or conclusion you get from something",And it gives an explanation of what this video is about and what the takeaways are.,260510,병찬,Y
It just figured it all out on its own.,"This means something (a person, animal, or system — here likely an AI) managed to solve or understand something completely, without any help or instruction — purely through its own process.",We never trained the AI model on that specific task — it just figured it all out on its own through pattern recognition,260510,병찬,Y
It's way more simple than you may think.,,This app is way more simple than the old one.,260510,병찬,Y
tireless,never getting tired or giving up — always working hard with endless energy and effort.,People on X are calling it a game changanger because it finally makes AI feel like a tireless colleague who actually remembers everything and it stays organized.,260510,병찬,Y
hack,modify or customize something freely,"Hey, this is left vague so that you can hack it and customize it to your own project.",260510,병찬,Y
Have big shoes to fill,To have to meet very high expectations set by a predecessor who was highly successful or respected.,Ternus certainly has big shoes to fill,260426,규영,Y
hang over,"To remain as a source of worry, pressure, or a threat. (드리워져 있다. 가시지 않다)",The big question mark hanging over Ternus is Apple’s efforts in AI.,260426,규영,Y
at its core,"At the most fundamental or essential level; in its most basic nature.(본질적으로, 핵심적으로, 내면 깊숙이, 속속들이.)",Ternus knows Apple at its core,260426,규영,Y
building off,To use something as a base or starting point to create something more advanced or complete.,Cook found steady success in services building off existing products,260426,규영,Y
volatile,"Liable to change rapidly and unpredictably, especially for the worse. (변덕스러운, 금방이라도 폭발할 것 같은.)","It’s up to Ternus to decide which path he will take, and whether Apple can create the next big thing in a volatile AI landscape.",260426,규영,Y
Substrate,"The surface or material on which something else exists, grows, or is attached. (바탕, 기저층, (표면 아래의) 기초가 되는 층, 토대.)",reframe the device as a substrate for intelligent experiences,260426,규영,Y
In a different level of,"Far superior to, or vastly different from, the typical examples of that category.","However, the current market feels like we're in a different level of uncertainty.",260426,병찬,Y
near-term,"Happening in or relating to the immediate future (typically the next few weeks or months, usually up to one year).",I really don't spend a lot of time worrying about the near-term or getting excited about the near-term.,260426,병찬,Y
Top Dog,"The most powerful, successful, or dominant person or company in a specific group.",number one is top dog and first mover in an important emerging industry.,260426,병찬,Y
Bullish,"optimistic or confident about something — expecting it to grow, succeed, or improve.","if you had never heard of intuitive surgical, that should make you even more bullish.",260426,병찬,Y
dissuade,to persuade someone not to do something — to talk them out of a plan or action they were considering.,I would never dissuade somebody in your channel or a friend of mine at a cocktail party.,260426,병찬,Y
In bits and pieces,"an idiom that means gradually, in small parts, or in a fragmented/incomplete way — not all at once, but little by little.","I sell and it's usually my winners and I sell them off in bits and pieces, charitable reasons sometimes.",260426,병찬,Y
A brief bout of,"A short period of time during which you experience a specific condition, emotion, or event (like an illness, a feeling, or a weather event).","A brief bout of physical exercise can create ""ripples"" of activity in your brain that help you store and retrieve memories.",260419,병찬,Y
Fickle,"Changing frequently, especially as regards one's loyalties, interests, or affection.",Memory can be such a fickle thing.,260419,병찬,Y
brisk,Quick and active; marked by speed and energy.,jump on an exercise bike for a few minutes or take a brisk walk.,260419,병찬,Y
benefit (as a verb),,There's a reason to stay active because you will benefit more every time.,260419,병찬,Y
reap,"To gather, receive, or enjoy the rewards of an action.","If you stick with exercise for six weeks, you will reap bigger benefits from any further sessions.",260419,병찬,Y
prompt,Noun. A set of instructions given to a computer system or AI.,"It found the tool can outperform humans at some hacking and cyber-security tasks, which has prompted discussions by regulators, legislators and financial institutions about the dangers it could pose to digital services.",260419,규영,Y
encompass,To include different types of things; to surround or cover something completely.,It encompasses the company's AI assistant and family of models,260419,규영,Y
dormant,Not active or growing but having the ability to be active at a later time.,They found the tool could locate dormant bugs lurking in decades-old code and easily exploit them.,260419,규영,Y
exploit,Verb. To make use of a situation or person in a way that is considered unfair; or to make full use of a resource.,They found the tool could locate dormant bugs lurking in decades-old code and easily exploit them.,260419,규영,Y
unearth,To find something that was hidden or lost; or to dig up something out of the ground.,"Mythos could unearth critical vulnerabilities much more quickly than other AI models had ""really shaken people"".",260419,규영,Y
breach,"An act of breaking or failing to observe a law, agreement, or code of conduct; or a gap made in a wall or barrier.",Most hackers do not need super AI tools to breach systems,260419,규영,Y
Inference,A conclusion reached on the basis of evidence and reasoning,"“So much more room to optimize AI inference for speed, memory usage, power consumption, and multi-tenant utilization,” he said in a post on X on Wednesday.",260413,병찬,Y
blistering,"Extremely fast, intense, or forceful",Memory stocks’ blistering rally,260413,병찬,Y
unprecedent,Never done or known before; without previous example,"Significant demand coupled with a shortage of supply, has pushed memory prices to unprecedented levels and supported profits for Samsung, SK Hynix and Micron.",260413,병찬,Y
de‑risk,"To make a situation, investment, or process less risky by identifying potential threats and creating ""safety nets.""","It does not alter the industry’s long‑term demand picture. In a market primed to de‑risk, even an incremental development can be taken as a cue to lighten up.”",260413,병찬,Y
coupled with,"Linked to, combined with, or occurring at the same time as something else.","Significant demand coupled with a shortage of supply, has pushed memory prices to unprecedented levels and supported profits for Samsung, SK Hynix and Micron.",260413,병찬,Y
fall under,"To be classified as part of a particular group, category, or jurisdiction;","The approval, which falls under the UN R-171 regulation for Driver Control Assistance Systems, comes after more than 18 months of testing and is currently valid only in the Netherlands",260413,규영,Y
provisional validity,Legal or official validity that is temporary and subject to change or final confirmation later.,European type approval with provisional validity in the Netherlands,260413,규영,Y
stress,noun. A state of mental or emotional strain.,The Dutch authority stressed that FSD Supervised is a driver assistance system — not an autonomous or self-driving system,260413,규영,Y
Exemption,The action of freeing someone or something from an obligation or liability imposed on others.,Tesla submitted documentation covering more than 400 compliance requirements under UN R-171 and Article 39 exemptions.,260413,규영,Y
explicit,"Stated clearly and in detail, leaving no room for confusion or doubt.",The RDW’s statement is explicit: FSD Supervised “can take over many driving tasks” but the vehicles “are NOT autonomous or self-driving.”,260413,규영,Y
intervene,To intentionally become involved in a difficult situation in order to improve it or prevent it from getting worse.,"The driver’s hands don’t need to rest on the steering wheel, but the driver must be able to intervene immediately.",260413,규영,Y
going public,The process where a private company (owned by its founders and a few investors) becomes a public company by selling its shares to the general public on a stock exchange (like the New York Stock Exchange or Nasdaq),"As SpaceX potentially readies to begin the progress of going public in the coming days, investors already have funds to play it.",260329,병찬,Y
Public Offering Prospectus,"A formal, legally required written document that provides full details about an investment offering for sale to the public.",The Information reported Tuesday that the Elon Musk-run startup is looking to file its initial public offering prospectus with regulators as early as this week.,260329,병찬,Y
Vying,Competing eagerly with someone in order to achieve something; fighting for superiority or a specific prize.,SpaceX has reportedly been looking at a Nasdaq listing while vying for early entry into the Nasdaq 100 index.,260329,병찬,Y
accounts for / nearly a quarter,"Makes up, represents, or is responsible for almost 25% of the total amount.","SpaceX also accounts for nearly a quarter or the Baron Focused Growth Fund (BFGIX). Tesla follows, representing just over 6% of holdings.",260329,병찬,Y
Come off,Having just completed or experienced something (usually a successful or intense period).,"But the fund is coming off three years of double-digit gains, Morningstar said.",260329,병찬,Y
bottom quartile of,The lowest 25% of a group when everything is ranked from best to worst (or highest to lowest).,"The fund added nearly 12% in 2025, but was among the bottom quartile of comparable offerings, per Morningstar.",260329,병찬,Y
Multi Tenant,An architecture in which a single instance of a software application or a hardware resource serves multiple customers or users.,"So much more room to optimize AI inference for speed, memory usage, power consumption, and multi-tenant utilization",260329,규영,Y
blister / blistering,Blister,Memory stocks’ blistering rally,260329,규영,Y
Profit-taking,The act of selling an asset (like stocks) that has risen in value to lock in the profit.,Analysts said the moves this week on memory stocks have largely been driven by profit-taking,260329,규영,Y
primed to,To be made ready for a specific purpose or action; to be in a state where one is very likely to do something soon.,"In a market primed to de‑risk, even an incremental development can be taken as a cue to lighten up",260329,규영,Y
lucrative,Producing a great deal of profit; highly profitable.,"How the red-hot AI data center boom is igniting demand for a new, lucrative career path",260322,병찬,Y
funnel,"a tube or pipe that is wide at the top and narrow at the bottom, used for guiding liquid or powder into a small opening.","Big Tech is funneling billions into building out these specialized facilities, with the four hyperscalers, Alphabet, Microsoft, committing nearly 700 billion in combined capex spending this year to fund these developments.",260322,병찬,Y
reached a fever pitch,"To become extremely intense, exciting, or agitated. It describes a situation that has reached its highest level of emotion or activity.","While anxiety around AI replacing white-collar jobs has reached a fever pitch, the data center boom is creating lucrative opportunities for skilled trade workers.",260322,병찬,Y
displace,To take the place of someone or something; to force something out of its usual or original position.,generative models will displace white-collar jobs.,260322,병찬,Y
retro / fitting,"The act of adding new components, technology, or features to an existing structure or system that did not have them when it was originally built.","Mathews noted “massive growth areas specific to labor” as a result of these retrofitting requirements, with network engineers, electricians, mechanical engineers, and plumbing and heating contractors deployed to install new liquid cooling systems.",260322,병찬,Y
Moat,"1. A deep, wide ditch surrounding a castle or town",Jensen Huang doesn’t need a new chip. He needs a new moat,260322,규영,Y
agnostic,Hardware or software that is compatible with many different systems,"At Nvidia’s annual developer conference, GTC, Huang launched NemoClaw, an open-source, chip-agnostic platform for building and deploying AI agents – autonomous software programs at the center of the latest advancements in the industry.",260322,규영,Y
Monetize,To utilize something as a source of profit;,Nvidia gives away the layer that drives adoption and monetizes what sits beneath it,260322,규영,Y
playbook,A set of rules or suggestions that are considered to be useful for winning or for achieving success,Huang is following that playbook — he isn’t charging for NemoClaw,260322,규영,Y
Weigh in,"To join a discussion or argument by offering your help, advice, or opinion.",“You don’t get to weigh in on that.”,260308,병찬,Y
vocally criticized,"To express disapproval or find fault with someone or something in a public, loud, or very direct manner.","Altman has been vocally criticized, including by some OpenAI employees",260308,병찬,Y
Cease,To come to an end or to bring something to an end; to stop happening or existing.,President Donald Trump also directed every federal agency in the U.S. to “immediately cease” all use of Anthropic’s technology.,260308,병찬,Y
Oust,"To drive out or expel someone from a position or place, often by force or through a formal legal or political process.","Anthropic’s AI was reportedly used in the Iran strikes over the weekend as well as for the capturing of ousted Venezuelan leader Nicolás Maduro and his wife, Cilia Flores, in January.",260308,병찬,Y
Concede,"To admit that something is true or valid after first denying or resisting it; or to surrender or yield something (like a goal, a point, or a victory).","Altman has defended OpenAI’s contract in various social media posts, though he conceded that it looked “looked opportunistic and sloppy” and that the company “shouldn’t have rushed to get this out on Friday.”",260308,병찬,Y
surveillance,"The careful and continuous watching of a person or place, especially by the police or army, because of a crime that has happened or is expected.","The company wanted assurance that its models would not be used for fully autonomous weapons or mass surveillance of Americans, while the DOD wanted Anthropic to agree to let the military deploy the models across all lawful use cases.",260308,병찬,Y
heated,"Characterized by strong emotion, intensity, or anger (especially in a discussion or argument).","Altman and Musk, two of the co-founders of OpenAI, are engaged in a heated legal battle that’s slated to go to trial next month.",260308,병찬,Y
adjunct professor,"A professor who is hired on a contractual, part-time basis rather than being a full-time member of the faculty. Often, they have a primary career outside of the university.","dietitian Dr. Michelle Cardel, chief nutrition officer at WeightWatchers and adjunct professor at the University of Florida.",260308,규영,Y
dietitian,An expert on diet and nutrition who helps people promote health and manage disease through specialized meal planning.,"dietitian Dr. Michelle Cardel, chief nutrition officer at WeightWatchers and adjunct professor at the University of Florida.",260308,규영,Y
longevity,Long life; the ability to last for a long time: Especially referring to a person's life span,balancing protein with fiber intake is going to be really important when thinking about longevity and optimizing health and well-being across the lifespan,260308,규영,Y
go overboard,To do something to a greater degree than is necessary or reasonable: To overdo something.,going overboard on protein and not balancing it with fiber could lead to weight gain or digestive problems.,260308,규영,Y
constipation,A condition in which there is difficulty in emptying the bowels: Usually associated with hardened feces.,One of the common signs is constipation,260308,규영,Y
soluble / insoluble,Able to be dissolved: Especially in water.,There are two types of dietary fiber: soluble and insoluble.,260308,규영,Y
First kind & Second Kind,Refers to the initial category or type in a list of several different classifications or groups.,There are two kinds of Claude users now. The first kind chats. The second kind delegates.,260302,병찬,Y
Delegate,"(Noun - /ˈdelɪɡət/): A person chosen or elected to represent a group, typically at a conference or meeting.",The second kind delegates.,260302,병찬,Y
Scatter,Occurring or found at intervals or in various locations rather than all together; spread over a wide area.,draft a report from these scattered notes.,260302,병찬,Y
Stark,Adjective: Unpleasantly clear or impossible to avoid (harsh); simple or bare in appearance (austere); or showing a very large and obvious difference (distinct).,The practical difference is stark.,260302,병찬,Y
tedious,"Too long, slow, or dull; tiresome or monotonous","The kind of tedious, structured work that sits at the intersection of ~",260302,병찬,Y
Sandbox,"Running a program or AI in a restricted, isolated digital environment so it cannot access or damage the rest of the computer system.",The core capability is simple: file system access in a sandboxed environment.,260302,병찬,Y
mundane,"Lacking interest or excitement; dull. It often refers to routine, everyday tasks that are not special or creative.","This sounds mundane until you realize how much time knowledge workers spend sorting downloads, organizing project files, or standardizing file names across a folder. Cowork handles this in minutes.",260302,병찬,Y
rattle,"To make someone nervous, worried, or confused","The U.S.-Israel conflict with Iran is extending into its third day with each side doubling down on sharper responses in the days ahead, deepening fears of a wider war that could rattle the global economy.",260302,규영,Y
Gulf countries,"The countries bordering the Persian Gulf. In a geopolitical context, it usually refers to the six members of the Gulf Cooperation Council (GCC): Saudi Arabia, Kuwait, the United Arab Emirates, Qatar, Bahrain, and Oman.","Tehran has struck back with missiles and drones against Israel and Gulf countries that host U.S. military bases, including the United Arab Emirates, Qatar, Kuwait and Saudi Arabia.",260302,규영,Y
designate,To officially choose someone or something for a particular purpos,he had not publicly designated a successor.,260302,규영,Y
Comprising,"To be made up of, To make up or form something","A council comprising Iranian President Masoud Pezeshkian, the judiciary head and a member of the Guardians Council, has temporarily assumed leadership duties on Sunday.",260302,규영,Y
parse,To analyze a string of symbols (data) or text,traders parsed risks of a drawn-out conflict and a major oil supply disruption.,260302,규영,Y
Casualty,A person killed or injured in a war or accident:,U.S. President Donald Trump has warned that there might be more American casualties as the operations unfold.,260302,규영,Y
