단어/표현,뜻,예문,날짜(YYMMDD),담당,보라색여부
aftermath,"The period or consequences following a significant, usually unpleasant event.",In the immediate aftermath of the strikes,251106,규영,Y
rail,verb. To complain angrily or criticize strongly about something.,Saturday's attack was an aggressive move for a president who boasted of starting no new wars during his first presidential term and who regularly railed against predecessors who had drawn the country into foreign conflicts on the campaign trail last year.,251106,규영,Y
Strive to,To try very hard to achieve or accomplish something,Striving to be a top performer at something can help encourage you and your team to create your best work and achieve your goals.,251026,병찬,Y
In a structured way,"to do something in an organized, systematic, and intentional manner — rather than randomly or informally.","Some businesses encourage competition in a structured way by publicly or privately ranking employees, posting performance metrics or giving rewards to top performers.",251026,병찬,Y
rationale,"the reasoning or explanation behind a decision, belief, or action. It explains why something is done or thought in a particular way.",Providing your rationale for introducing competition to the workplace also opens a discussion among your team and gives them the chance to ask questions and address any concerns they have.,251026,병찬,Y
fruition,"The point at which a plan, project, or idea is successfully completed and produces the desired result.","The tech giant used the stage to unveil features across all its most popular products, even bringing AI experiments that were previously announced to fruition.",251026,규영,Y
be promising,"Showing signs of future success, good results, or positive development.","Some of the updates were really promising, including the incorporation of Project Mariner, a research prototype built on Gemini 2.0 that can automate tasks in your browser and will be able to purchase tickets and book reservations on your behalf.",251026,규영,Y
roundup,"A summary or collection of information, events, or items gathered together, often highlighting the most important points.",We have reached the part of the roundup where the value of the announcements is measured by how transformational they will be in the future.,251026,규영,Y
break down,"To analyze or explain something in smaller, simpler parts.","In this article, we’ll break down Perplexity AI vs ChatGPT and highlight their pros and cons to help you decide which one is right for you.",250928,병찬,Y
Pull something from,"means to take, extract, or retrieve something from a source.","You can customize your search to pull results from specific sources, making it easier to find exactly what you need.",250928,병찬,Y
Group something into,"organize or classify things by putting them into categories, sets, or groups based on shared characteristics.","You can group searches into collections, making it easier to keep track of information for ongoing projects, research papers, or personal reference.",250928,병찬,Y
storied (career),"A career that is famous or well-known, often because it includes many notable achievements, events, or has a long and distinguished history.","With such a storied career under his belt, it’s no surprise investors of all ages attend Berkshire Hathaway’s annual shareholder meeting year after year to hear the Oracle of Omaha speak.",250928,규영,Y
championed (Champion),"to fight or speak publicly in support of (a person, belief, cause, etc.)",Buffett has famously championed a long-term strategy of buying and holding stocks,250928,규영,Y
speculative,an investment involving a high risk of loss,"rather than trying to time the market or get rich quickly on newer, more speculative investments like cryptocurrency.",250928,규영,Y
Take on responsibility,"Accept and begin handling a task, role, or duty",help you take on more responsibility at work and move your career forward.,250914,병찬,Y
Bettering,"present participle or gerund form of the verb ""to better,"" which means to improve — whether it's yourself, someone else, a situation, or performance",She’s dedicated to bettering herself through study and self-discipline.,250914,병찬,Y
In that way,"phrase used to refer to a specific method, manner, or reason previously mentioned. It often means ""by doing so"", ""as a result"", or ""like that"", depending on context.","After improving yourself in that way, you may find that you can help mediate parties with different opinions.",250914,병찬,Y
halt,to stop (something or someone) from moving or continuing,"It did, however, point to an update to the Model Y during the quarter that temporarily halted production at all four of its factories for several weeks.",250914,규영,Y
be poised to,"to be ready or prepared to do something, or to be in a position where something is likely to happen soon.",Tesla is poised to lose that title in 2025,250914,규영,Y
X in X,"X out of every X, or xx%. It is a common way to express proportions or statistics in a clear and relatable way.",Seven in 10 people around us have done something nice … in the past month.,250907,병찬,Y
is down from a spike,"that something (like a number, rate, or level) has decreased after previously rising sharply. A “spike” refers to a sudden and noticeable increase, and “is down” means it has fallen since that high point.",This trend of doing kind things is down from a spike during the Covid-19 pandemic,250907,병찬,Y
Follow through,"a phrasal verb that means to complete something you started or carry out a plan, task, or promise to the end. It emphasizes seeing things through to completion.",She always follows through on her commitments.,250907,병찬,Y
Lingering,lasting for a long time or slow to end,The cold is lingering[dragging] on a very long time,250907,규영,Y
Reciprocal,"used to describe a relationship in which two people or groups agree to do something similar foreach other, to allow each other to have the same rights, etc.",Trump outlining a plan for “reciprocal tariffs” on countries that have tariffs on US goods,250907,규영,Y
Elaborate,"to give more details about something, to discuss something more fully","While Buffett didn’t elaborate on his comment about tariffs being an act of war,",250907,규영,Y
Wear stock tire,"Normally, wear means to have clothes on. But in automotive English, wear can also mean to be fitted with or equipped with.","The Polestar 3 wore stock Michelin Sport 4 EV tires on stock 20-inch wheels, though it's well known that greater range does not favor large wheels.",250817,병찬,N
Hypermile,"to drive in an extremely fuel-efficient way, using special techniques to get the maximum distance out of each unit of fuel (or electricity for EVs)",We all know how to hypermile an EV.,250817,병찬,N
running out of juice,Literally: juice can mean liquid power (like fruit juice).,it still drove for an extra eight miles before actually running out of juice.,250817,병찬,N
evolve,"to develop gradually, especially into a more advanced","If we bring these two together, we can have a common vision for how technology can have an impact on people and how people can adapt and evolve to leverage the new technology.",250817,규영,N
diluting (Dilute),to make a liquid thinner or weaker by adding water or another liquid,merging the departments risks losing or diluting the specialist expertise organisations need to thrive,250817,규영,N
thrive,"to grow, develop, or be successful",merging the departments risks losing or diluting the specialist expertise organisations need to thrive,250817,규영,N
Reprieve,"A temporary relief from something harmful, difficult, or unpleasant; in business, often refers to a delay or suspension of unfavorable actions like penalties or taxes.","For the past three months, goods shipped from Vietnam to the United States were tariffed at a minimum 10% rate, a reprieve from the 46% rate that briefly went into effect in April before Trump announced a pause.",250629,병찬,N
Framework,"A basic structure underlying a system, agreement, or process.","Vietnam’s state-run news outlet, Việt Nam News, referred to the agreement on Wednesday as “a framework.”",250629,병찬,N
Self-imposed,"Decided or applied by oneself, not by an external authority.","As his self-imposed July 9 deadline for deals approaches with few new agreements in place, Trump has threatened to raise tariffs again.",250629,병찬,N
stockpile,To accumulate a large reserve of goods for future use.,"And businesses often stockpile inventory ahead of tariffs, delaying cost increases for themselves and for customers.",250629,병찬,N
Onshore - Offshore,"Means “on the shore” or “on land” as opposed to water, sea, or offshore locations.
It’s used to describe locations or activities happening on land, especially when contrasted with the sea or foreign countries.",It can take several years for businesses to onshore manufacturing.,250629,병찬,N
Dispute,"To disagree or argue about something, often publicly or officially.",Caleb Petitt...disputed the idea that American businesses will benefit from the tariffs.,250629,병찬,N
Level the playing field,To create fair conditions where no side has an unfair advantage.,"Trump’s tariffs are intended to “level the playing field for American industries and workers,” Desai said.",250629,병찬,N
Foot the bill,"To pay for something, often something costly or unexpected.","Businesses foot the initial tariff bill for imported goods, but they often pass on some of those costs to consumers.",250629,병찬,N
distinguished,adj. known by many people because of some quality or achievement,"Ali Saidi, a distinguished engineer at AWS",250629,규영,N
liken,Verb. To say that someone or something is similar to another person or thing.,"Ali Saidi, a distinguished engineer at AWS, likened the speed to a machine reading 100 music CDs a second.",250629,규영,N
outpacing,To move or develop faster than someone or something else.,The demand for these chips is already outpacing supply,250629,규영,N
put A up against B,"To place something in competition or comparison with someone or something else, often to evaluate its strength, quality, or performance.",The chip is a win for the company’s custom strategy and putting it up against traditional semiconductor players like Intel and AMD.,250629,규영,N
obliterate,"completely destroy, erase, or remove all traces of something.","President Donald Trump says the US has carried out a ""successful"" bombing attack on three nuclear sites in Iran and said they have been ""obliterated"".",250622,병찬,N
penetrate,"go into, pass through, or gain access to something, either physically or metaphorically.","Due to Fordo's depth below ground only the US has the kind of ""bunker buster"" bomb big enough to penetrate the site - the GBU-57 Massive Ordnance Penetrator (MOP).",250622,병찬,N
Kinetic energy,Kinetic energy is the energy an object possesses due to its motion.,The huge weight of the bomb results in a large amount of kinetic energy on impact.,250622,병찬,N
Casing,"noun that refers to a cover, shell, or outer layer that protects or encloses something.","This energy drives ""the dense alloy casing"" up to 60 metres underground",250622,병찬,N
barbaric violation,"An act that violently disrespects or harms someone or something in a way that is inhuman, savage, or uncivilized.","The Iranian Atomic Energy Organization said the bombing of the three nuclear sites was a ""barbaric violation"" of international law.",250622,병찬,N
retaliate,take revenge or respond to a harm or attack by doing something similar in return.,How might Iran retaliate?,250622,병찬,N
Reserve the right,"a formal phrase meaning that someone or some organization keeps the option open to take a certain action in the future, especially under specific circumstances.",Iran's Foreign Minister Abbas Araqchi condemned the US strike and said Tehran reserved the right to respond.,250622,병찬,N
regime [reɪˈʒiːm],"Government or political system, especially an authoritarian one","But doing nothing makes the Iranian regime look weak, especially after all its warnings of dire repercussions if the US did attack.",250622,병찬,N
repercussions,"a bad or serious result of something you do — often something that happens later, not immediately.","But doing nothing makes the Iranian regime look weak, especially after all its warnings of dire repercussions if the US did attack.",250622,병찬,N
arsenal,A collection of weapons and military equipment,Iran still has a substantial arsenal of ballistic missiles after manufacturing and hiding these away for years.,250622,병찬,N
Dismantle,To physically take something to pieces,"It said its ambition was to dismantle its nuclear programme, which Prime Minister Benjamin Netanyahu said would soon be able to produce a nuclear bomb.",250622,병찬,N
taking office,"the act of beginning a formal position of authority or responsibility, especially in government.",Far from bringing peace to the Middle East since taking office,250622,규영,N
preside,"Acting as the person in charge of a formal event, meeting, court, or ceremony.",Trump is now presiding over a region on the precipice of even greater warfare - a fight in which America is an active participant.,250622,규영,N
precipice,a very steep side of a mountain or cliff,Trump is now presiding over a region on the precipice of even greater warfare - a fight in which America is an active participant.,250622,규영,N
Flank,"Verb. To be situated at the side of someone or something, or to surround them on both sides; also, to attack from the side (military use).","Flanked by Vice-President JD Vance, Secretary of State Marco Rubio and Defence Secretary Pete Hegseth, Trump warned Iran",250622,규영,N
bravado,"A show of boldness or confidence intended to impress or intimidate others, often without real courage behind it.","Despite the president's bravado, a continued American military engagement in Iran may be a worst-case scenario for the US, the region and the world.",250622,규영,N
spiral of chaos,"A rapidly worsening situation marked by increasing disorder, conflict, or instability, where each event feeds into the next in a destructive cycle.","UN Secretary General António Guterres warned of a ""spiral of chaos"" that could result from the American decision to escalate the conflict",250622,규영,N
compelled,"To be forced to do something, or to feel a strong internal urge to do something.",If Iran retaliates - as Ayatollah Ali Khamenei warned would happen in the event of a US attack - then the American side may feel compelled to respond.,250622,규영,N
lure,"verb. To attract or tempt someone or something, often by offering some kind of reward or advantage.",A bid to lure the Iranians into a false sense of security this weekend?,250622,규영,N
unwilling to,Not prepared or eager to do something; reluctant or disinclined to take an action.,it seems unlikely that a nation unwilling to talk while under Israeli attack will be more inclined when American bombs are also falling.,250622,규영,N
singular,"grammar. Denoting a single person, thing, or instance (as opposed to plural).",She has a singular talent for music.,250622,규영,N
uprising,"An act of resistance or rebellion against authority or government, usually by a group of people.",the president could have an uprising with his ranks.,250622,규영,N
facilitate,"make something easier or smoother to do, especially by helping a process or activity happen more effectively.","In this article, we present 5 practical keys to facilitate the selection process and find the perfect employee for your business.",250608,병찬,N
Selection process,"refers to the step-by-step method used to choose the best option, typically in contexts like hiring, admissions, procurement, or project decisions.","In this article, we present 5 practical keys to facilitate the selection process and find the perfect employee for your business.",250608,병찬,N
Carrying out,To put something into effect or follow through with a task or responsibility.,Carrying out an analysis of your company's strengths and weaknesses will allow you to identify what gaps you need to cover,250608,병찬,N
transparent,Allowing light to pass through so that objects behind can be seen clearly.,Write a detailed and transparent job offer,250608,병찬,N
filters out,"remove or block unwanted parts from something, usually to leave only what is relevant, useful, or needed.","A well-written job offer not only attracts the best candidates, but it also filters out those that don't fit the profile sought.",250608,병찬,N
shortlist,"smaller group of candidates or options selected from a larger pool, usually for final consideration.","Once the most promising candidates have been shortlisted, evaluate their competencies by",250608,병찬,N
promising candidate,"Someone who appears likely to succeed, perform well, or meet expectations based on their skills, experience, or attitude.","Once the most promising candidates have been shortlisted, evaluate their competencies by",250608,병찬,N
delve,To dig into something — either literally (like digging into the ground) or figuratively (like researching a topic in depth).,"In the final interview, delve into the candidate's profile and make sure they understand their responsibilities within the company.",250608,병찬,N
disposition,"Personality / Temperament
→ A person’s usual mood or behavior tendency.",Your attitude and disposition: Does it fit the company culture?,250608,병찬,N
rhetoric,the art or skill of speaking or writing formally and effectively especially as a way to persuade or influence people,This isn’t empty rhetoric,250608,규영,N
grads,"an informal, shortened form of graduates.","Last week, a senior LinkedIn executive reported that AI is already starting to take jobs from new grads",250608,규영,N
universal basic income (UBI),"government or public institution provides all citizens with a regular, unconditional sum of money, regardless of their income, employment status, or wealth, to ensure a basic level of financial security.",A commonly proposed solution for an impending era of technological unemployment is government-granted universal basic income (UBI).,250608,규영,N
impending,about to happen very soon,A commonly proposed solution for an impending era of technological unemployment is government-granted universal basic income (UBI).,250608,규영,N
bargaining,"The act or process of negotiating the terms and conditions of a transaction, agreement, or exchange.",But this could dramatically change how citizens participate in society because work is most people’s primary bargaining chip.,250608,규영,N
uphold,"support, maintain, or defend something",Our modern world is upheld with a simple exchange,250608,규영,N
be posed to (be supposed to),"ready to do something,","With AGI, we are posed to change",250608,규영,N
Curse,Noun. A powerful or magical wish that something bad will happen to someone.,“The Intelligence Curse”,250608,규영,N
afflicted with,"To be affected by something harmful or unpleasant, especially a disease, condition, or problem.","Just like in oil-rich states(원유가 풍부한 주) afflicted with the “resource curse(자원의 저주),” governments won’t have to invest in their populations to sustain their power.",250608,규영,N
grappling with,struggle to deal with or understand a difficult problem or concept,"Many of the people grappling with the other major risks from AGI—that it goes rogue, or helps terrorists create bioweapons",250608,규영,N
rogue,"a person or thing that behaves in an unpredictable, uncontrolled, or unconventional way, often causing trouble.","Many of the people grappling with the other major risks from AGI—that it goes rogue, or helps terrorists create bioweapons",250608,규영,N
tacit,Expressed or understood without being directly stated; implied.,AI tools could capture the tacit knowledge visible to you every day and turn it into your personal data moat.,250608,규영,N
unfathomable,Adjective. impossible to understand or impossible to measure the extent of.,"You could be the owner of a business, deploying AI you control on data you own to solve problems that feel unfathomable to you today.",250608,규영,N
Cultivate competition,"To foster or promote competition among individuals, teams, or businesses.","In this article, we explain the importance of cultivating competition at work and explore strategies for developing a positive culture of competitiveness on your team.",250601,병찬,N
elective,Optional; not required; chosen by choice.,Your team may see elective competitions as a fun opportunity instead of an extra mandatory assignment.,250601,병찬,N
lightheart,"Cheerful, carefree, or not too serious",Promoting the lighthearted aspects of competition can help everyone feel comfortable and confident in their own pace while still striving to achieve their best.,250601,병찬,N
Increase in morale,"an improvement in the overall mood, motivation, or confidence of a group of people — often in a workplace, team, or organization.",This allows everyone to have the chance to win a competition and spread around the increase in morale instead of having one or two people consistently winning every competition.,250601,병찬,N
mutual,"an adjective that means shared by two or more people or groups — something that is felt, done, or experienced equally by both sides.",Share techniques for improving workplace processes and encourage your staff to mentor one another to drive mutual growth.,250601,병찬,N
Rivalry,"is a noun that refers to a situation in which two or more people, teams, or groups compete against each other — often in a continuous or intense way.","This allows you to build teamwork, share skills and develop a network of support while still enjoying the benefits of rivalry.",250601,병찬,N
be meant to,"To be intended, expected, or supposed to do something.",They're meant to transform how you use Google offerings,250601,규영,N
firehose,"a hose used to spray water in large volumes, especially by firefighters.",Since such a firehose of information is packed into a two-hour keynote address,250601,규영,N
flashy,"Bright, colorful, and easily noticed — sometimes in a way that is not tasteful or is meant to show off.","inbox cleanup is perhaps one of the least flashy, and it is easy to lose it in the shuffle of the news",250601,규영,N
Agentic,"That behaves like an agent, assuming no responsibility for actions or their consequences, onlyfollowing the orders of someone in authority.",Agentic shopping,250601,규영,N
score a deal,"To successfully obtain or negotiate a favorable deal, often with effort or luck.","If you like to score a deal, this ""buy for me"" feature will be your best friend.",250601,규영,N
ante,"An initial bet or stake put into the pot by a player before the deal begins, especially in poker.","Now, Google is raising the ante by making Gemini Live with camera and screen sharing free for everyone on both Android and iOS.",250601,규영,N
reason,"Verb. To think, understand, and form judgments logically about something; to use rational thinking to come to a conclusion or make a decision.","it reasons through different decisions that allow it to debug your code, build new features, write tests, and more.",250601,규영,N
glimpse,"A brief or partial view into something, such as the future or a concept","Android XR shows a glimpse of how all of the AI advancements we have spoken about above will manifest in the physical world to make our lives easier, acting as a vehicle that bridges the physical world with AI for added assistance.",250601,규영,N
manifest,"To show or display something clearly, especially a feeling, quality, or condition.","Android XR shows a glimpse of how all of the AI advancements we have spoken about above will manifest in the physical world to make our lives easier, acting as a vehicle that bridges the physical world with AI for added assistance.",250601,규영,N
Carbohydrates (abbr Carbo),탄수화물,Base your meals on higher fibre starchy carbohydrates,250525,병찬,N
Starchy,"containing a lot of starch, a substance found in many plants that provides energy when eaten. Often refers to dry, dense, or carbohydrate-rich foods.",Starchy carbohydrates should make up just over a third of the food you eat,250525,병찬,N
X for X,"This format is typically used to compare two things on the basis of equal units — like per gram, per dollar, per mile, etc.","Some people think starchy foods are fattening, but gram for gram the carbohydrate they contain provides fewer than half the calories of fat.",250525,병찬,N
sugary,Often used to describe food or drinks high in sugar.,these drinks are sugary and can damage your teeth.,250525,병찬,N
a portion of,"means a part or section of a whole. It’s often used when talking about quantities, groups, time, food, or resources.","Eat more fish, including a portion of oily fish",250525,병찬,N
canned,(of food or drink) preserved or supplied in a sealed can,"You can choose from fresh, frozen and canned, but remember that canned and smoked fish can be high in salt.",250525,병찬,N
Saturated fat,"saturate = fill something completely so that no more can be added. It can be used literally (with liquids) or figuratively (with things like information, colors, or markets).",Cut down on saturated fat and sugar,250525,병찬,N
obesity,is a medical condition in which a person has excess body fat that may negatively affect their health.,Regularly consuming foods and drinks high in sugar increases your risk of obesity,250525,병찬,N
