단어/표현,뜻,예문,날짜(YYMMDD),담당,보라색여부
fizzy drinks,"beverages that are carbonated, meaning they contain bubbles of carbon dioxide gas. They're also known as soft drinks or soda in many English-speaking countries.",sugary fizzy drinks,250525,병찬,N
teaspoonful,"refers to the amount that fits in one teaspoon — a small unit used in cooking or measuring ingredients, especially in recipes.",Adults and children aged 11 and over should eat no more than 6g of salt (about a teaspoonful) a day.,250525,병찬,N
obese,"describe a person who is very overweight with a high amount of body fat, usually to the point where it can negatively affect health","Being overweight or obese can lead to health conditions, such as type 2 diabetes, certain cancers, heart disease and stroke.",250525,병찬,N
tug-of-war,"A physical contest in which two teams pull on opposite ends of a rope, trying to drag the other team across a central line.",The return-to-office (RTO) debate has become a tug-of-war between advocates from both ends of the spectrum.,250525,규영,N
abundantly,In a way that is more than enough; in large amounts; very clearly.,it's becoming abundantly clear that it’s more complicated than that,250525,규영,N
hop on,"To get on something quickly or easily, like a bus, train, bike, or other vehicle.
It can also mean to join in on an activity or conversation.",While many big-name companies are taking advantage of current labor conditions to hop on the highly-publicized RTO bandwagon,250525,규영,N
bandwagon,"A popular activity, idea, or trend that many people start to support or follow — often just because others are doing it.",While many big-name companies are taking advantage of current labor conditions to hop on the highly-publicized RTO bandwagon,250525,규영,Y
nuanced,"Having small and subtle differences, especially in meaning, feeling, or opinion.
A nuanced idea or statement shows deep understanding and careful thinking.","We surveyed over 1,000 U.S. workers¹, and our research reveals a nuanced picture of employee sentiment toward office work",250525,규영,N
vehicle,"A method or tool to express or achieve an idea, feeling, or goal.","For early-career professionals entering a tighter job market, the office environment may take on added significance as a vehicle for professional development and networking",250525,규영,N
embrace,To hug someone,"Many others, particularly those whose job satisfaction is rooted in more than work-from-home flexibility, report choosing to embrace the change",250525,규영,N
stark contrast,A very clear and obvious difference between two things.,What's particularly interesting in our research is the stark contrast in attitudes between those who have returned to the office compared with those who haven't.,250525,규영,N
be stationed in,"To be placed or assigned to live and work in a specific location, usually for a job, often in the military or a company.","While I was stationed in [South] Korea on a remote tour, I met a few people that hated it because they missed their families and never went far from the base.",250525,규영,Y
drawing parallel,Comparing two things to show that they are similar in some way.,"he explains, drawing parallels to his previous experience on active duty",250525,규영,N
pronounced,Very noticeable or clear; something that stands out a lot.,This preference for remote work is particularly pronounced among certain demographics.,250525,규영,Y
demographics,"Information about groups of people, such as their age, gender, income, education, or where they live.",This preference for remote work is particularly pronounced among certain demographics.,250525,규영,N
versatile,an adjective that means able to do many different things well or useful in many situations.,"ChatGPT is a versatile AI that can help with writing, problem-solving, and more, while Perplexity AI is designed to provide accurate, research-based answers.",250518,병찬,N
fact-check,"means to verify whether information is true, accurate, or based on real facts","It tells you exactly where the information came from, so you can fact-check it yourself.",250518,병찬,N
prone,"Likely to experience or do something, especially something bad or harmful.",it tends to be more accurate and less prone to hallucinations compared to other AI chatbots.,250518,병찬,N
Market Cap,"The total value of a company’s outstanding shares of stock, calculated by multiplying the current stock price by the total number of outstanding shares.",Berkshire hit a market cap of 1 trillion in 2024,250518,규영,N
storied career,"A career that is famous or well-known, often because it includes many notable achievements, events, or has a long and distinguished history.","With such a storied career under his belt, it’s no surprise investors of all ages attend Berkshire Hathaway’s annual shareholder meeting year after year to hear the Oracle of Omaha speak.",250518,규영,Y
under one's belt,"Having achieved or experienced something that adds to one's knowledge, skills, or accomplishments.","With such a storied career under his belt, it’s no surprise investors of all ages attend Berkshire Hathaway’s annual shareholder meeting year after year to hear the Oracle of Omaha speak.",250518,규영,N
pivotal,crucial importance in relation to the development or success of something else,an attendee asked Buffett about the “pivotal lessons” he learned early in his career.,250518,규영,N
Along with,In addition to; together with someone or something.,"Buffett emphasized the importance of finding a job that you actually like, along with working for people you respect and can learn from.",250518,규영,N
be better off,"To be in a more favorable situation, especially in terms of wealth, comfort, or well-being.",you’ll be better off identifying your own passions and smart people in your orbit,250518,규영,N
Securities,"Tradable financial assets such as stocks, bonds, or options that represent ownership or a creditor relationship with a company or government.",If people are making more money because they’re borrowing money or participating in securities that are pieces of junk ... you have to forget that.,250518,규영,N
championed,"to fight or speak publicly in support of (a person, belief, cause, etc.)",Buffett has famously championed a long-term strategy of buying and holding stocks,250518,규영,Y
a sense of,"a feeling, awareness, or impression of something. It’s commonly used to describe internal experiences or perceptions—emotions, attitudes, or even physical states.",A job may be important for a sense of purpose since it can provide goals to work toward each day and an income to support you financially,250512,병찬,N
good fit,"something or someone matches well with another thing — in terms of style, needs, values, skills, or purpose. It’s commonly used in both personal and professional contexts.",Is this job a good fit for yourself and your family?,250512,병찬,N
feel fulfilled,"experience a deep sense of satisfaction, contentment, or purpose, especially from something meaningful like work, relationships, or personal growth.",How do you find jobs to feel fulfilled?,250512,병찬,N
Resonate,"often used to describe something that deeply connects, emotionally or intellectually, with someone.",Ask yourself why they appeal to you and choose one that most resonates with you,250512,병찬,N
excel,to do something very well or to be exceptionally good at something.,Try to remember what subjects you excelled in or which ones you wanted to learn more about but didn't have a chance to.,250512,병찬,N
overreliance,Excessive dependence on someone or something.,experts have urged people to consider the potential risks of an overreliance on AI in the industry.,250513,규영,N
susceptible,"Likely to be influenced, affected, or harmed by something.",She highlighted how AI systems could be susceptible to biases,250513,규영,Y
biases,"prejudice, A tendency to favor or dislike someone or something unfairly, often without enough reason or based on personal opinions.",She highlighted how AI systems could be susceptible to biases,250513,규영,N
admission,"The act of being allowed to enter a place, organization, or institution.",He claims it has helped to reduce preventable health events leading to hospital admissions,250513,규영,N
Reassure,To say or do something to make someone feel less worried or afraid.,it has also been used to reassure family members that a loved one receiving end-of-life care was not in pain.,250513,규영,N
Panacea,A solution or remedy for all problems or difficulties; something that is believed to solve everything.,There is a potential risk that AI is going to be seen as a panacea to some of those very big problems,250513,규영,Y
cutting edge,The most advanced and newest stage in the development of something.,We will harness cutting-edge technology to transform social care,250513,규영,Y
By taking steps to,is a common phrase used to express the means or method by which someone starts addressing a problem or working toward a goal,"By taking steps to improve yourself, you can also acquire skills outside of traditional educational and occupational settings.",250413,병찬,N
Aid,"Means help, support, or assistance, especially in times of need",Having well-developed hard and soft skills can aid you in a variety of workplace settings.,250413,병찬,N
Advance along,"A phrase that means to move forward or progress along a path, road, timeline, or process.","By reading often, you can gain more insight into your field and develop a strategic vision that helps you advance along your career path.",250413,병찬,N
Competitive edge,"refers to an advantage that allows a person, company, or product to outperform others in the same industry, market, or environment.","In addition to standard abilities, pay attention to emerging skills that could help you gain a competitive edge.",250413,병찬,N
Pinpointing,"it means to identify, locate, or define something with precision — especially when something is hard to find, explain, or understand.",Rethinking the way you spend your day and pinpointing your most productive hours can help you identify new ways to maximize the time you have.,250413,병찬,N
Adopting a routine,"to begin consistently following a regular pattern of behavior or activities, often with the goal of improving productivity, health, or overall lifestyle.","Adopting an exercise routine can also clear your mind and help you relax, which can improve your productivity.",250413,병찬,N
Status quo [ ˈkwoʊ ],"the existing state of affairs, especially referring to the current situation or how things are right now — often in a social, political, or business context.","For example, you can start by questioning the status quo and any assumptions about your life situation.",250413,병찬,N
backflash,to a strong negative reaction by a large number of people,as backlash against CEO Elon Musk,250413,규영,N
take a large bite out of of demand,to significantly reduce or diminish it.,growing competition took a large bite out of demand for its EVs,250413,규영,N
vandalism,The act of deliberately destroying or damaging property,"There have also been instances of vandalism against Tesla facilities, including its charging stations, as well as some cars.",250413,규영,N
stun,to surprise or upset (someone) very much,The decline is stunning for a company,250413,규영,N
year-over-year,Compared to the same time period in the previous year.,The decline is stunning for a company that until recently was reporting year-over-year sales growth of between 20% and 100% virtually every quarter,250413,규영,N
be a bull on,to be optimistic or confident about the future performance or success of that thing — especially in a financial or market,who has been a bull on Tesla,250413,규영,N
confrontational,"describes a person, attitude, or situation that is aggressive, argumentative, or eager to provoke conflict or confrontation.","confrontational statements and postings on social media, Musk has become a lightning rod for people opposed to the policies of the Trump administration",250413,규영,N
lightning rod,someone or something that attracts criticism or gets blamed when things go wrong,Musk has become a lightning rod for people opposed to the policies of the Trump administration.,250413,규영,N
substantially,"very much, a lot",more substantially unpopular than Vice President JD Vance,250413,규영,N
liberal,believing that government should be active in supporting social and political change; relating to or supporting political liberalism compare CONSERVATIVE1,"Those negative opinions of Musk are bleeding over into negative views of Tesla, especially among those who identify as liberals",250413,규영,N
poll,an activity in which several or many people are asked a question or a series of questions inorder to get information about what most people think about something,And polling indicates Tesla is losing favor.,250413,규영,N
Republican,a person who believes in or supports a republican form of government,"there has been a big change in customer loyalty between so-called “blue states,” which have voted for a Democrat in the last four presidential elections, and “red states” where Republicans won.",250413,규영,N
agitation,"means a state of nervousness, restlessness, or excitement — often caused by worry, anger, or anxiety.","It’s a label for physical agitation in the body and a way of thinking that distorts things to look negative, pessimistic, and hopeless.",250406,병찬,N
distort,"means to twist or change something out of its original, true, or natural shape, meaning, or condition. It can refer to physical appearance, facts, sound, or even the truth.","It’s a label for physical agitation in the body and a way of thinking that distorts things to look negative, pessimistic, and hopeless.",250406,병찬,N
Being driven by,"means that a person’s actions, thoughts, or motivations are strongly influenced or controlled by something — like an emotion, goal, or external factor.",it is absolutely possible to live in this world without being driven by it.,250406,병찬,N
Sift,"means to separate or examine something carefully, often to find what’s most important or useful. It can be used literally or figuratively.","Like sand sifting through your fingers, there’s nothing to hold onto…and, like a miracle, you discover you’re free…",250406,병찬,N
vulnerable,"means easily hurt, harmed, or affected — either physically, emotionally, or in a broader sense like being at risk.","We’re afraid of being alone, of not having enough money, of being vulnerable with people, of failing (or succeeding), of stepping outside of our comfort zone, of death.",250406,병찬,N
procrastination,"the act of delaying or postponing something — especially tasks that need to be done, often in favor of doing more enjoyable or easier things instead.","It’s at the root of procrastination, addiction, compulsive behavior, inadequacy, shame, and envy.",250406,병찬,N
untangle,"means to separate things that are twisted or knotted, or to make something complicated easier to understand or fix.",This is how we untangle fear,250406,병찬,N
Hasten,"1. to move or act quickly
2. to cause (something) to happen more quickly","Not spending enough time in the two deep stages of sleep may hasten the deterioration of parts of the brain associated with Alzheimer’s disease, a new study found.",250406,규영,Y
deterioration,"the process of becoming worse in condition, quality, or function over time.","Not spending enough time in the two deep stages of sleep may hasten the deterioration of parts of the brain associated with Alzheimer’s disease, a new study found.",250406,규영,Y
early indicators,"signs or signals that appear at the beginning of a process or condition, suggesting that something is starting to happen or is likely to happen in the future.",Deficits in slow-wave and REM sleep appear to shrink parts of the brain known to be early indicators of cognitive deterioration and Alzheimer’s disease,250406,규영,N
inferior parietal region,"Part of the Brain: Located in the parietal lobe, towards the back and lower side of the brain.",a part of the brain called the inferior parietal region,250406,규영,N
synthesize,to make (something) by combining different things,That part of the brain synthesizes sensory information,250406,규영,N
neurodegeneration,"the gradual loss or damage of neurons (nerve cells) in the brain or spinal cord. This process can lead to the decline of cognitive, motor, or sensory functions",it makes sense that it shows neurodegeneration early in the disease,250406,규영,N
infant,"a very young child, baby",infants can spend about 50% of their sleep in REM.,250406,규영,N
Sleep hygiene,habits and practices that are conducive to sleeping well on a regular basis,The good news is that you can easily train your brain to better sleepby following what is called “sleep hygiene.”,250406,규영,N
Optimal,Best or most effective,Make sure your sleeping environment is optimal,250406,규영,Y
booze,to drink a lot of alcohol,Avoid booze before bed,250406,규영,N
Metabolize,to change (food) into a form that can be used by your body; to process and use (substances brought into your body) by metabolism,When your liver finishs metabolizing the alcohol at 3 a.m.,250406,규영,N
benevolence,"refers to the quality of being kind, helpful, and generous. It embodies a disposition to do good and act charitably toward others",This year’s report paid special attention to acts of benevolence and people’s expectations of their communities.,250330,병찬,N
Doer,"someone who takes action, gets things done, and doesn’t just talk or plan — they follow through and make things happen.",There is evidence that doing nice things helps both the recipient and the doer feel happier,250330,병찬,N
generosity,"a noun that refers to the willingness to give or share, especially freely and unselfishly, whether it’s money, time, help, kindness, or resources.",Acts of generosity predict happiness even more than earning a higher salary,250330,병찬,N
By and large,"is an idiom that means ""in general"", ""for the most part"", or ""overall."" It’s used when you want to summarize or give a general impression, even if there are a few exceptions.","By and large, we find in almost all of our studies that people randomly assigned to spend generously report feeling higher levels of happiness than people who spend on themselves.",250330,병찬,N
Cudgel,to hit (someone or something) with a club,Tariffs are considered by many economists a political cudgel — sometimes used in a trade war — and not an efficient framework for international trade.,250330,규영,N
the late,"""The late"" is an adjective used before a person's name to indicate that they have passed away. It is a respectful way to refer to someone who is deceased.",The segment focused on the late Katharine Graham,250330,규영,N
The Oracle of Omaha,a person (such as a priestess) through whom a god was believed to speak,"The Oracle of Omaha said it’s critical to ask, “And then what?” when thinking about the implications of tariffs and who will bear the cost.",250330,규영,N
Implication,a possible future effect or result,"The Oracle of Omaha said it’s critical to ask, “And then what?” when thinking about the implications of tariffs and who will bear the cost.",250330,규영,N
amass,To collect or gather a large amount of something over time,"Berkshire amassed its cash and cash equivalents to a record 334.2 billion in the fourth quarter,",250330,규영,N
Surge to a record,"means to increase rapidly and reach the highest level ever recorded. It is commonly used in financial, economic, and statistical contexts.",Berkshire’s operating earnings in the fourth quarter surged to a record,250330,규영,N
Operating Earning,"a company's profit from its core business operations, excluding taxes and interest expenses.",Berkshire’s operating earnings in the fourth quarter surged to a record,250330,규영,N
The Tooth Fairy doesn't pay 'em!,,,250330,규영,N
Snappy,Stylish or Fashionable: Refers to a smart and stylish appearance,These aren’t just snappy sayings for t-shirts,250309,병찬,N
Affirmation,a positive statement or declaration that something is true. It is often used to promote self-empowerment and positive thinking.,They’re positive affirmations that can be a powerful tool in helping to shape your outlook.,250309,병찬,Y
roadblocks,"is a barrier or obstruction placed across a road to control or restrict traffic flow, often used by law enforcement or military personnel to stop vehicles for checks or to prevent passage.",Remembering challenges you have overcome in the past can help inspire you to face future roadblocks.,250309,병찬,N
Be stuck at,"can describe a situation where someone is unable to move forward or make progress, either physically or metaphorically.","""stuck at home with nothing to do” can be reframed as being “safe at home with an opportunity to connect with my family.",250309,병찬,Y
Get caught in,"becoming unexpectedly involved in or trapped by a situation, often without intention or desire. This can apply to both literal and figurative contexts.",It’s easy to get caught in a spiral of anxious thoughts about the future.,250309,병찬,Y
Mark a turning point,"an event or moment represents a significant change, shift, or transition in a situation, history, or someone’s life. It is often used to describe critical moments that lead to a new direction or development.",Why DeepSeek could mark a turning point for Silicon Valley on AI,250209,병찬,N
Be coming to grips,"gradually understanding, accepting, or dealing with a difficult situation or problem. It suggests an ongoing process of learning, adjusting, or managing something challenging.",Silicon Valley is coming to grips this week with the realization that creating an advanced artificial intelligence model may no longer be as specialized a task as was once believed.,250209,병찬,Y
more or less on par with,"something is approximately equal to, similar to, or at the same level as something else, but with some minor differences. It suggests near equivalence rather than an exact match.","The wakeup call came in the form of DeepSeek, a year-old Chinese start-up whose free, open-source AI model, R1, is more or less on par with advanced models from American tech giants",250209,병찬,N
throw more resources,"to allocate or invest additional resources (such as money, time, people, or effort) into something in an attempt to improve or solve a problem. It often implies an urgent or reactive approach to dealing with challenges.",they could throw more resources at the problem than anyone else and come out on top.,250209,병찬,Y
Be committed to,"to be dedicated, devoted, or fully engaged in doing something. It expresses a strong promise, responsibility, or determination to achieve a goal or fulfill an obligation.",We’re committed to moving really quickly here. We want to stay ahead.,250209,병찬,Y
malfeasance,"wrongful, illegal, or dishonest conduct, especially by a public official or a person in a position of authority. It is often used in legal, political, and corporate contexts.","Even if the company achieved its efficiency revolution with some malfeasance, DeepSeek’s achievements have lit a fire under Silicon Valley’s AI industry.",250209,병찬,N
Lit a fire,"This expression means to motivate or prompt someone to take action, especially if they have been inactive or slow to act. It’s often used to describe encouraging someone to work more quickly or with greater enthusiasm.","Even if the company achieved its efficiency revolution with some malfeasance, DeepSeek’s achievements have lit a fire under Silicon Valley’s AI industry.",250209,병찬,N
supremacy,"refers to the state or condition of being superior to all others in authority, power, or status. It denotes a leading or controlling position, often implying dominance or preeminence over others",we thought we had global AI supremacy,250209,병찬,N
Short-lived,Adj. lasting only a short time,The first punches have been thrown between the United States and China in what could amount to a short-lived trade dispute with limited economic fallout or the start of yet another lengthy and painful trade war reminiscent of President Donald Trump’s first term.,250209,규영,N
Reminiscent,"Adj. reminding you of someone or something else, similar to something else",The first punches have been thrown between the United States and China in what could amount to a short-lived trade dispute with limited economic fallout or the start of yet another lengthy and painful trade war reminiscent of President Donald Trump’s first term.,250209,규영,Y
Coal,Noun. a black or brownish-black hard substance within the earth that is used as a fuel,certain types of coal and liquefied natural gas and a 10% tariff on crude oil,250209,규영,N
Displacement,the act of forcing people or animals to leave the area where they live,large-displacement cars and pickup trucks,250209,규영,N
Hamper,"to slow the movement, progress, or action of (someone or something)",The move significantly hampers the companies’ ability to do business in China.,250209,규영,N
Engage in,to cause (someone) to take part in (something),It’s possible that Trump and Chinese President Xi Jinping will at least agree to postpone these actions to engage in further dialogue,250209,규영,N
